{
  "action": "close_task",
  "budget_profile": "standard",
  "modes": [
    "exact",
    "fts"
  ],
  "normative_sources_sha256": "43c0990e110fec3ae97a99bd2fc7b43a31c5786e21f9ce7b8876811c87efb3ac",
  "query_text": "停止预算与跨会话防循环已完成并通过CI；现仅登记收尾结果及原有脏文件保留事实",
  "requested_additional_control_types": [],
  "schema_version": "6.3-candidate",
  "stage": "S8",
  "tailoring_resolution_sha256": "04088f52c2da1f61760003656ea203bc025d781d91ad82a6cd380571c6710da5",
  "task_id": "T-BUDGET-20261023-001"
}
